tweet_id,tanggal,username,teks,likes,retweets,replies,views,brand_disebut,sentimen,link_rekomendasi,url
2071117742703579196,2026-06-28 06:25:24,Meeen,"@yuxioao SOALNYA CANTIK BANGET, kayaknya yang lain juga sepakat deh sama aku? Eh tapi cocok nih videonya buat iklan kayak skincare gitu. Langsung keinget innisfree HAHAHA.",0,0,1,30,Innisfree,positif,-,https://x.com/Meeen/status/2071117742703579196
2071114597881483770,2026-06-28 06:12:54,daisofia_,"@tanyakanrl Skincare ga siii, skincare korea bagus bagus",0,0,0,266,-,positif,-,https://x.com/daisofia_/status/2071114597881483770
2071111933605068887,2026-06-28 06:02:19,daisofia_,Nemu Flatshoes model ballerina speedcat yg modelnya ga pasaran LUCU BANGETT😭💗💗🫶🏻 https://t.co/KmDUfl9TkI,3,1,2,1901,-,netral,-,https://x.com/daisofia_/status/2071111933605068887
2071107012847435852,2026-06-28 05:42:45,_flyingeze,"☀️ Sunscreen sticks are having a major moment — and for good reason. Quick to apply, mess-free, and perfect for topping up SPF on the go. But which one comes out on top? Read the review 👇 https://t.co/uE9PuJP2fe #Skincare #SPF #Sunscreen #BeautyTips #SummerBeauty",0,0,1,9,-,positif,https://www.flyingeze.com/tried-best-sunscreen-stick,https://x.com/_flyingeze/status/2071107012847435852
2071102049555746940,2026-06-28 05:23:02,ntaasaputri,"@kartikaardhiana Gatau kak Padahal skincare gak ganti, kebiasaan juga sama.. Tp tiap habis makan kacang selalu tumbuh jerawat, trus sekarang jerawatku banyak dan meradang kak Mbok obatin apa kak kalo boleh tau? Share dong Karena aku, jujurly jarang berjerawat",0,0,1,20,-,positif,-,https://x.com/ntaasaputri/status/2071102049555746940
2071090438703034472,2026-06-28 04:36:54,loeymingyu_,"pernah lewat di fyp gw kl period poverty ini masi byk bgt kejadiannya. menurut gw bener bgt makin ke sini harga pembalut makin mahal. udh gitu pembalut udh kek skincare, cocok²an. ada yang cocok pake brand A yang murah, ada yang cocoknya pake brand B yang mahal dikit—",0,0,1,104,-,positif,-,https://x.com/loeymingyu_/status/2071090438703034472
2071089258484613623,2026-06-28 04:32:12,earphoneuser,"kulitku cocok pake skincare drugstore. wah ini aku juga baru baru ini menyadarinya juga. krn sudah keseringan pake skincare korea, aku sempat khawatir kalau pindah ke skincare lain akan jerawatan dll. Alhamdulillah enggaa.. skrg jd pake skincare drugstore buat maintenance kulit",0,0,1,13,-,positif,-,https://x.com/earphoneuser/status/2071089258484613623
2071071589404409870,2026-06-28 03:22:00,IndonesiaFedera,"Hubungan Emosi dan Kecantikan Pernah gak kamu merasa saat sedang stres, kulit tiba-tiba kusam, muncul jerawat, atau terlihat lebih lelah? Nah Ternyata, emosi dan kecantikan saling berhubungan. Ketika kita mengalami stres berkepanjangan, tubuh melepaskan hormon kortisol yang dapat memengaruhi kondisi kulit dan tubuh. Akibatnya: ■ Kulit menjadi lebih sensitif ■ Jerawat lebih mudah muncul ■ Kulit terlihat kusam dan lelah ■ Tidur menjadi tidak berkualitas ■ Rambut lebih mudah rontok Karena itu, merawat diri tidak cukup hanya dengan skincare. Kulit yang sehat juga membutuhkan: 🌿 Pikiran yang lebih tenang 🌿 Tidur yang cukup 🌿 Mengelola emosi dengan baik 🌿 Waktu untuk beristirahat 🌿 Melakukan hal-hal yang membuat hati bahagia. Karena menjadi cantik bukan hanya tentang apa yang kamu aplikasikan ke wajah. Tetapi juga tentang bagaimana kamu memperlakukan dirimu sendiri setiap hari.",2,1,0,524,-,positif,-,https://x.com/IndonesiaFedera/status/2071071589404409870
2071068206878593361,2026-06-28 03:08:33,starlitmxrklee,"@dkisdokiyeom kalo bisa balik ke basic skincare dlu aja kaa kyk pake moist rutin dlu, rekomendasi si dr yg pelajar firendly ada g2g kandungan ceramide tuh yg ungu klo centella yg bening tutup ijo, sama dr omg ada yg ceramide + panthenol, nah kalo yg lbh mahal ada dr skintific biru",0,0,1,97,Skintific,positif,-,https://x.com/starlitmxrklee/status/2071068206878593361
2071060938162344345,2026-06-28 02:39:40,minagud,REKOMENDASI PAKETAN / BUNDLE SKINCARE / MAKE UP 💄💕💓❣️ https://t.co/niQJJmXu7I,0,0,1,17,-,positif,-,https://x.com/minagud/status/2071060938162344345
2071057912257257902,2026-06-28 02:27:39,yawnomi,"19. Gue suka makeup tapi lebih suka skincare an, karena menurut gue kalo muka bersih ya hasil makeup bakal lebih bagus #prinsip",0,0,1,93,-,positif,-,https://x.com/yawnomi/status/2071057912257257902
2071053351161344085,2026-06-28 02:09:31,_bywilder,"@zakariamlk memacu dermatitis kontak pasti TAPI hanya beberapa orang yang kulitnya sensitif, ya sama aja beberapa orang bisa pakai produk skincare A beberapa orang gak cocok cenderung bikin ruam. jangan terlalu dijadikan patokan, bahas secara ilmiah.",0,0,1,17,-,positif,-,https://x.com/_bywilder/status/2071053351161344085
2070900565857706408,2026-06-27 16:02:25,spacerangersRRR,"Voucher Halodoc Tercuan 🤩🤩 Chat Dokter Spkk, Psikolog, Gizi, Obgyn, dll 💥 HLDXC5K6D Beli Obat, Vitamin, Skincare 💥 HLDXOA72M Homecare: Lab, Vaksin, MCU 💥 HLDXHQUHD Haloskin: Jerawat, anti-aging 💥 HLDXSBX0X Halofit utk program diet 💥 HLDXFSHW7 #zonauang #zonajajan",0,0,0,278,-,positif,-,https://x.com/spacerangersRRR/status/2070900565857706408
2070885056974143628,2026-06-27 15:00:47,haehyuckku,"1. Selesai mandi, pakai skincare rekomendasi Haechan. Parfumnya juga pakai yang Haechan share terakhir. https://t.co/tUVioeSjxp",0,0,1,53,-,positif,-,https://x.com/haehyuckku/status/2070885056974143628
2070883661675942127,2026-06-27 14:55:14,imzie111,LO GA BUTUH LEBIH BANYAK SKINCARE. LO BUTUH NYEMBUHIN PCOS. 1. Jerawat batu di rahang yang ga pernah absen tiap bulan,1,1,9,192,-,netral,-,https://x.com/imzie111/status/2070883661675942127
2070872760033620459,2026-06-27 14:11:55,Amit27423213,"@umgnaya_ ih parah banget ya kalau lagi sakit jadi males skincare, tapi kalau jerawat udah muncul aku biasanya pake Benzolac biar cepet kempes https://t.co/wgJdOcHFp0",0,0,0,46,-,negatif,https://s.shopee.co.id/9Kg0oc9U7t,https://x.com/Amit27423213/status/2070872760033620459
2070865100303663574,2026-06-27 13:41:29,guanokturnall,"REVIEW JUJUR Muka gua bersihan pake ini, baru pemakaian botol pertama, tapi hasilnya udah mencerahkan sedikit, dan bekas jerawat gua pudarrrrrr woiii gokil gasih #zonauang #skincare https://t.co/xmk8l6alDO",0,0,1,169,-,positif,-,https://x.com/guanokturnall/status/2070865100303663574
2070863555138875520,2026-06-27 13:35:20,spacerangersRRR,"Voucher Halodoc Jun 2026🔥 💖 HLDXC5K6D Konsul Dokter SpKK, Obygn, Gizi, DSA, Psikolog 💖 HLDXOA72M Beli Obat, Vitamin, Skincare 💖 HLDXSBX0X Haloskin: Obat Jerawat, Anti Aging 💖 HLDXHQUHD Homecare: Vaksin, Tes Lab, Booster 💖 HLDXFSHW7 Halofit: Diet #zonajajan #zonauang",0,0,0,303,-,positif,-,https://x.com/spacerangersRRR/status/2070863555138875520
2070852252793983203,2026-06-27 12:50:26,hamkeyoo,"Benerrr, gue mau nyari rekomendasi skincare aja sekalinya muncul affiliate semuaaa",0,0,0,38,-,positif,-,https://x.com/hamkeyoo/status/2070852252793983203
2070823553180778600,2026-06-27 10:56:23,avoskinbeauty,"Alpha Arbutin! Kalau yang bikin kesel bekas jerawat hitam (PIH) yang nggak ilang-ilang, kalian bisa cari skincare yang mengandung Alpha Arbutin. Kalau mau coba, Avoskin YSB Alpha Arbutin Serum juga enak karena gampang di-layer dengan skincare lain, jadi fleksibel buat dipakai di berbagai routine ☺️",1,0,1,199,Avoskin,netral,-,https://x.com/avoskinbeauty/status/2070823553180778600
2070823515570512283,2026-06-27 10:56:14,avoskinbeauty,"TOP 3 INGREDIENTS SKINCARE BIKIN KULIT CERAH Kalau masih struggle sama kulit kusam atau bekas jerawat yang susah pudar, 3 ingredients ini wajib kamu coba! https://t.co/dpfq5wwsE7",8,1,3,1558,-,positif,-,https://x.com/avoskinbeauty/status/2070823515570512283
2070814696840860026,2026-06-27 10:21:12,umgnaya_,"ga skincare an selama sakit, muka langsung muncul jerawat 4 biji wkwk",6,0,5,1084,-,netral,-,https://x.com/umgnaya_/status/2070814696840860026
2070791714311471459,2026-06-27 08:49:52,ustadchen,Sekarang twitter search jelek banget ya??? Susah banget mau nyari satu keyword aja pun???,16620,2659,511,1438584,-,negatif,-,https://x.com/ustadchen/status/2070791714311471459
2070789072571011377,2026-06-27 08:39:22,spacerangersRRR,"Voucher Diskon Halodoc JUN 2026🫶🏻 Konsul Dokter Spkk,Psikolog,Gizi,dll 💖 HLDXC5K6D Tebus/beli obat,skincare,vitamin 💖 HLDXOA72M Haloskin : utk jerawat&amp;kulit kusam 💖 HLDXSBX0X Homecare : vaksin HPV,Influenza,MCU 💖 HLDXHQUHD Halofit: Diet 💖 HLDXFSHW7 #zonauang #zonajajan",0,0,0,353,-,positif,-,https://x.com/spacerangersRRR/status/2070789072571011377
2070787843149189565,2026-06-27 08:34:29,dokterdiskon,"VOUCHER HALODOC TERBARU !! ✅ HLDXCX7TE Chat dokter umum dan spesialis ✅ HLDXOHTXA Beli obat, vitamin ✅ HLDXH5C5L Homecare tes lab, bidan ke rumah ✅ HLDXS1FC6 Skincare haloskin anti jerawat ✅ HLDXF57BE Paket diet halofit #zonauang #zonajajan",0,0,0,215,-,positif,-,https://x.com/dokterdiskon/status/2070787843149189565
2070782766829178947,2026-06-27 08:14:19,cowosukamatcha,@isfunnyyyy @SKIN1004_id nih ges yg butuh rekomendasi skincare,0,0,0,69,-,positif,-,https://x.com/cowosukamatcha/status/2070782766829178947
2070782471931896055,2026-06-27 08:13:09,carousxel,"Dan jujur, gw ngerti. Cantik itu bukan cuma muka, bro. Tapi attitude, style, vibe, semua nyatu jadi satu paket bernama: Gw. Gak semua orang bisa punya itu. Gw bangun tidur aja, muka udah kayak iklan skincare. Belum cuci muka, belum gosok gigi, tapi aura good looking udah nembus",0,0,0,58,-,positif,-,https://x.com/carousxel/status/2070782471931896055
2070772950660481300,2026-06-27 07:35:19,dellucyaa,"@biruismine_ scora pink bup. dulu muka gua banyak bruntusan &amp; jerawat. sekarang udah better banget karena pake fw ini, btw di bantu sama skincare kandungan centella lain nya jugaa lup lup",1,0,1,181,-,netral,-,https://x.com/dellucyaa/status/2070772950660481300
2070755272004710618,2026-06-27 06:25:04,fairyzielle,"beneran sengaruh itu d3+zinc plus tiap hari, rambut rontok gw berkurang banget da jerawat tiap mens cepet bgt meletusnya dan ilang (pakai skincare fokus acne juga sih)",0,0,0,42,-,positif,-,https://x.com/fairyzielle/status/2070755272004710618
2070748202282987562,2026-06-27 05:56:58,andhika_ant,"Jerawat meradang bikin insecure ? Ini wajib banget jd skincare routine kamu. Intouface shouting cream. Membantu meredaka jerawat, kemerahan dan samarkan bekas jerawat. Kulit jd lebih tenang dan sehat. Harga mulai 30 ribuan aja, sudah BPOM..",0,0,1,19,-,netral,-,https://x.com/andhika_ant/status/2070748202282987562
2070744286921105576,2026-06-27 05:41:25,cheriecookies,"@basebuku Jujur tiap aku mau beli buku pasti ditawarin sama ortu ku dulu, kalau mau beli buku pake uang bapak aja uang mu buat beli apa kek skincare atau baju😭😭👍👍",0,0,0,46,-,netral,-,https://x.com/cheriecookies/status/2070744286921105576
2070734608677982311,2026-06-27 05:02:57,spacerangersRRR,"Voucher Halodoc Terbaru ‼️ Chat Dokter Spkk, Psikolog, Gizi, Obgyn, dll 💥 HLDXC5K6D Beli Obat, Vitamin, Skincare 💥 HLDXOA72M Homecare: Lab, Vaksin, MCU 💥 HLDXHQUHD Haloskin: Jerawat, anti-aging 💥 HLDXSBX0X Halofit utk program diet 💥 HLDXFSHW7 #zonauang #zonajajan",0,0,0,329,-,positif,-,https://x.com/spacerangersRRR/status/2070734608677982311
2070732491863077197,2026-06-27 04:54:33,nadiawidha,udah dermatologically tested dan aslii bener2 happy nemuin facial wash yang gentle bisa bantu ngurangin bakteri jerawat yang se GERCEP ini🫵🏻😇 kalo lagi bruntus atau acne hormonal gini tinggal lanjut pake basic skincare deyy! https://t.co/F4AIJx2f4s,0,0,1,101,-,netral,-,https://x.com/nadiawidha/status/2070732491863077197
2070726059398451593,2026-06-27 04:28:59,unsoedmfs,"Loakjends! kalau skincare ini aku jual lebih murah dari harga pasaran pada mau gak? 🥹✨ Masih baru &amp; segel semua yaa. Jujur skincare numpuk banget 😭 Daripada keburu expired, kepikiran mau aku jual murah. Kalau minat, komen yaa! Nanti aku upload list produknya. https://t.co/EPLsMwfQVf",248,2,190,24437,-,netral,-,https://x.com/unsoedmfs/status/2070726059398451593
2070703897954656313,2026-06-27 03:00:55,yourmeankoo_,"WANT TO SALE PRELOVED MOP GWS BERRYPHORIA 💸60k 🚚shopee freeong bisa COD daerah pasming sekitarnya pemakaian bersih yaa, warnanya cakeupp wtb wts rekomendasi lip gloss matte velvet tint lipstick makeup skincare lippies jkt jakarta mother of pearl #zonauang #Zonajajan #zonaBU https://t.co/LbyrQ9tMTi",1,1,0,2194,-,positif,-,https://x.com/yourmeankoo_/status/2070703897954656313
2070673224984318427,2026-06-27 00:59:02,spillbymochi,"JUJUR YAA, STOP DEH BELI SKINCARE INI‼️ 1. Facial Wash : Cetaphil 2. Cleansing Oil : Centella 3. Spray Serum : D’Alba 4. Moisturizer : La Roche Posay 5. Sunscreen : Centella￼",0,0,1,76,Cetaphil,netral,-,https://x.com/spillbymochi/status/2070673224984318427
2070627521918566545,2026-06-26 21:57:26,eskacanghijaauu,"@yappingfess Rajin exfo, pakai retinol, dan ga pernah males buat skincare an nder. Ini ada rekomendasi basic skincare yg beneran ampuh buat biki wajah cerah. Wajahku aja dl belang kusam gt sekarang udh cerah mulus shinning shimmering splendid ✨ https://t.co/zon8ICFbXZ",0,0,0,126,-,positif,https://x.com/eskacanghijaauu/status/2045149401036005639?s=46,https://x.com/eskacanghijaauu/status/2070627521918566545
2070602247902552251,2026-06-26 20:17:00,ciii_caa,"@tanyakanrl kurangi upf, gula, gorengan, tepung2an. byk minum air putih. sering ganti sarung bantal &amp; handuk. basic skincare. pilih sunscreen yg cocok (salah pilih bikin jerawat muncul/parah). bisa ke dokter buat tau st/skincare yg cocok. acne spot bisa pake adara extra/benzolac",0,0,0,260,-,positif,-,https://x.com/ciii_caa/status/2070602247902552251
2070520735655940388,2026-06-26 14:53:06,michellaboo,"Untuk traveling, menyimpan cosmetics, skincare, charger dll https://t.co/w47zZ2S0R0 Rekomendasi 1000/10 https://t.co/21paQf6DuI",0,0,0,22,-,positif,https://s.shopee.co.id/50X06Z4xUf,https://x.com/michellaboo/status/2070520735655940388
2070510460181635195,2026-06-26 14:12:16,aestylla,jujur baru tau inez punya skincare 🥲,0,0,0,9,-,netral,-,https://x.com/aestylla/status/2070510460181635195
2070473418013851957,2026-06-26 11:45:05,kupon_halodoc,"Punya keluhan masalah kulit, coba pakai paket Haloskin Lab by halodoc. Dapatkan Gratis Ongkir Rp22.000 untuk pembelian paket Haloskin Lab 🔗 Gunakan link ini: https://t.co/5Y4pRt0dKQ 🎟 Kode Kupon: HLDXSCB0K #skincare #jerawat #racunx #zonajajan",0,0,0,65,-,netral,https://halodoc.onelink.me/cQvV/xdan1fj4,https://x.com/kupon_halodoc/status/2070473418013851957
2070469818063655149,2026-06-26 11:30:46,beautyayyy,Stop skip moisturizer ya guys! Jujur aja aku sering skip &amp; efeknya skin barrier jadi rewel bgt🥹 Akhirnya skrng lagi balik ke basic skincare &amp; lg suka pakai Ceraboost moistnya Trueve ini and it’s a game changer! ✨ https://t.co/srkucyg9N7,81,58,40,2813,-,positif,-,https://x.com/beautyayyy/status/2070469818063655149
2070466714098418046,2026-06-26 11:18:26,tiwtik,my skin has been loving this combo lately oily skin friendly moisturizer kadang skincare yang bagus itu justru yang ga kerasa dipake 👀✨ https://t.co/uVmPR60JJ7,33,24,2,1685,-,positif,-,https://x.com/tiwtik/status/2070466714098418046
2070464661678604317,2026-06-26 11:10:17,runningxwild,"@tanyakanrl kakk jujur aku dl pake banyak bgt skincare tpi ga sembuh-sembuh, terus giliran aku cma pake moist glowsophy sama sunscreen Emina malahh memudarrrrr wkwkw",0,0,0,203,Emina,netral,-,https://x.com/runningxwild/status/2070464661678604317
2070461740358549609,2026-06-26 10:58:40,beryulna,"@rrevuhree aku pernah karna makanan,hormon mau red day, sama stress sihhh biasanya nahh yg aku lakuin kurangin makanan pemicu jerawat, sama pake bassic skincare aja sih double cleansing,sunscreen dan moiz aja kadang pake seetmask klo mau tidur samaa satu lagi less makeup biar kulitnya nafas",0,0,1,132,-,netral,-,https://x.com/beryulna/status/2070461740358549609
2070458658455208241,2026-06-26 10:46:26,spacerangersRRR,"Voucher Halodoc Jun 2026🔥 💖 HLDXC5K6D Konsul Dokter SpKK, Obygn, Gizi, DSA, Psikolog 💖 HLDXOA72M Beli Obat, Vitamin, Skincare 💖 HLDXSBX0X Haloskin: Obat Jerawat, Anti Aging 💖 HLDXHQUHD Homecare: Vaksin, Tes Lab, Booster 💖 HLDXFSHW7 Halofit: Diet #zonajajan #zonauang",0,0,0,302,-,positif,-,https://x.com/spacerangersRRR/status/2070458658455208241
2070455850146337009,2026-06-26 10:35:16,lioarchives,"tpi pembalut itu seharusnya gratis kak setidaknya utk kelompok perempuan tertentu dan wajib harganya murah, bnyak perempuan yg terpaksa beli produk ga jelas dan bisa berbahaya buat kesehatannya hanya karna harganya murah. dan ini bukan berarti aku against program kondom gratis.",11044,2475,9,171997,-,positif,-,https://x.com/lioarchives/status/2070455850146337009
2070455013907042559,2026-06-26 10:31:57,ollafiliet,@fasyalalal kalau skincare aku fw : emina yang hijau untuk jerawat toner : yang hatomugi kuromi moist : emina yang hijau tutup biru serum : hanasui warna ungu sunscreen : wardah acne,0,0,0,149,"Wardah, Emina",netral,-,https://x.com/ollafiliet/status/2070455013907042559
2070453060661657836,2026-06-26 10:24:11,Raditya40101149,Noda hitam bekas jerawat bandel? 😮‍💨 Coba BIOAQUA 377 DARK SPOT SET Isi 4: Cleanser + Toner + Serum + Cream Ada 5% Niacinamide buat samarin flek 1 set = skincare pagi malam beres Link: https://t.co/23gEUmmcCq #bioaqua #darkspot #skincareindonesia #flekhitam #niacinamide https://t.co/LzpRHQJql2,1,0,0,60,-,netral,https://s.shopee.co.id/3g1cDUwCxW,https://x.com/Raditya40101149/status/2070453060661657836
2070439911761772917,2026-06-26 09:31:56,Miryshei,"@bermuara_sayang Kalau kamu mau nanya rekomendasi, bingung bikin routine, pengen nyocokin produk, atau cuma pengen ngobrol random soal makeup and skincare, PLEASE DO. I promise I (WE, ACTUALLY) won't get bored in fact, I'll probably get even more excited than you, hehe. Aku sudah berusia 23+ -",0,0,1,48,-,positif,-,https://x.com/Miryshei/status/2070439911761772917
2070424968358424731,2026-06-26 08:32:33,VasyAulia,#racunshopee #rekomendasi #skincare,0,0,0,35,-,positif,-,https://x.com/VasyAulia/status/2070424968358424731
2070424589109448861,2026-06-26 08:31:03,piezzzyyy,"Fakta yang sering diabaikan: Jerawat gak selalu datang karena hormon atau makanan. Kadang pemicunya justru dari kebiasaan skincare setelah aktivitas panjang. Terutama ketika minyak, kotoran, dan bakteri terlalu lama menempel di kulit. Dan ini sering dianggap sepele.",0,0,1,5,-,netral,-,https://x.com/piezzzyyy/status/2070424589109448861
2070419668482072762,2026-06-26 08:11:30,spacerangersRRR,"Voucher Diskon Halodoc JUN 2026🫶🏻 Konsul Dokter Spkk,Psikolog,Gizi,dll 💖 HLDXC5K6D Tebus/beli obat,skincare,vitamin 💖 HLDXOA72M Haloskin : utk jerawat&amp;kulit kusam 💖 HLDXSBX0X Homecare : vaksin HPV,Influenza,MCU 💖 HLDXHQUHD Halofit: Diet 💖 HLDXFSHW7 #zonauang #zonajajan",0,0,0,369,-,positif,-,https://x.com/spacerangersRRR/status/2070419668482072762
2070410283173200245,2026-06-26 07:34:12,brigitteaditria,"@tanyakanrl kak, kebetulan skintypeku juga oily. aku pake rangkaian skincare salah satunya serum vitamin c ini ya. bisa buat ngilangin bekas jerawat tapi pakenya memang harus rajin biar keliatan hasilnya",0,0,1,602,-,netral,-,https://x.com/brigitteaditria/status/2070410283173200245
2070409204633067626,2026-06-26 07:29:55,_skinbyinez,"@twitnyapimma hai, Minez disini🙋‍♀️ jujur siapa yang baru tau kalo Inez punya skincare juga?",0,0,0,6,-,netral,-,https://x.com/_skinbyinez/status/2070409204633067626
2070404656916988158,2026-06-26 07:11:51,lunedelaviee,"haii kak, boleh rekomen krim atau skincare apapun yang bisa buat hilangin bekas jerawat? huhu aku stress bgt, in this econo… — hi sayangku, seperti di question sebelumnya, aku belum pernah bermasalah dengan jerawat TAPIII aku udah nanya sama beberapa … https://t.co/rh4ULb2Ufx",0,0,0,330,-,netral,https://alterspring.org/@lunedelavie/a/116815161308171341,https://x.com/lunedelaviee/status/2070404656916988158
2070314721702822098,2026-06-26 01:14:28,owandobby,Review Skintific 5X Ceramide Barrier Repair Moisture Gel ⭐4.5/5 https://t.co/aWUw0kSsbR https://t.co/t4IcigcEYX,0,0,1,133,Skintific,netral,https://s.shopee.co.id/6L2Mmam4mI,https://x.com/owandobby/status/2070314721702822098
2070161344725385262,2026-06-25 15:05:00,zayaaf1,"@yappingfess Eh skintint Wardah yang pink itu bagus g ya kak, sama cushion Wardah lite. Butuh review dong, soalle ak nyari yang murah juga in this economy",0,0,0,560,Wardah,positif,-,https://x.com/zayaaf1/status/2070161344725385262
2070142516549026234,2026-06-25 13:50:11,tanyakanrl,"💚 Guys saranin cushion untuk kulit kuning langsat gini dong, aku udh pake wardah 22 ligh ivory tp kuning bgt kya dfoto, nyatu ke kulit kaya gapake bedak. Jd aku pengen stingkat lebih cerah, boleh merk apapun, pliss butuh review jujur https://t.co/MBbYnSlYvl",23,2,30,19032,Wardah,positif,-,https://x.com/tanyakanrl/status/2070142516549026234
2069729567112405083,2026-06-24 10:29:17,sourskittlesz,aku dah tak percaya kalau troy ling review g2g or skintific products sorry girl,3,0,0,228,Skintific,netral,-,https://x.com/sourskittlesz/status/2069729567112405083
2068730965145645277,2026-06-21 16:21:11,happciest,"@yappingfess Skintint yg baru aku coba ini seamakeup cakep banget, review jujur asli mah, kalo mau cushion aku pake somethinc yg cover blur ya bagus ini full coverage tapi masih ringan , gak longsor semua, aku oily btw",3,0,0,236,Somethinc,positif,-,https://x.com/happciest/status/2068730965145645277
2068669696950583362,2026-06-21 12:17:44,luluhusnaa,review singkat somethinc ceraplump shade cherry cantik banget buat inner ombreeeee!!!!!! https://t.co/cvYYMcKRbb,61,2,27,5420,Somethinc,netral,-,https://x.com/luluhusnaa/status/2068669696950583362
2067076543097250297,2026-06-17 02:47:06,kikozrr,"── REKOMENDASI SKINCARE ── ꢾ୧. aku sedikit share dan review skincare yang aku pakai dan urutannya yaps, skin stype aku normal to dry iaa! &lt;33 - a thread https://t.co/MeAQbKpCjX",12,7,2,3509,-,positif,-,https://x.com/kikozrr/status/2067076543097250297
2066760181904810209,2026-06-16 05:50:00,dokterdiskon,‼️UPDATE VOUCHER HALODOC JUNI 2026‼️ Aktif mulai 16 Juni 2026 Chat dokter 🎟️ HLDXCX7TE Beli obat 🎟️ HLDXOHTXA Homecare 🎟️ HLDXH5C5L Haloskin 🎟️ HLDXS1FC6 Halofit 🎟️ HLDXF57BE #zonauang #zonajajan https://t.co/YtV9Bwm2vg,1,0,0,2098,-,positif,-,https://x.com/dokterdiskon/status/2066760181904810209
2066732292899553311,2026-06-16 03:59:11,oppabugar,VOUCHER PROMO HALODOC Berlaku mulai tanggal 16 JUNI 2026 Chat dokter 🎫 HLDXCV40L Beli obat 🎫 HLDXOAJ2S Homecare 🎫 HLDXHDBAF Haloskin 🎫 HLDXSN7EK Halofit 🎫 HLDXFDSAF #zonauang #zonajajan https://t.co/cc0ykRZMVi,0,0,0,4592,-,positif,-,https://x.com/oppabugar/status/2066732292899553311
2066536029193216062,2026-06-15 14:59:18,spacerangersRRR,"Voucher Diskon Halodoc Juni 26🔥 (16-30 June 2026) 🎟️ HLDXC5K6D 💬 chat dokter SpKK,Obgyn,Psikolog,Gizi 🎟️ HLDXOA72M 💊obat,vitamin 🎟️ HLDXHQUHD 💉Homecare vaksin,MCU,Lab 🎟️ HLDXSBX0X 🧴 Haloskin utk jerawat 🎟️ HLDXFSHW7 🦾 Halofit utk program diet #zonauang #zonajajan️️ https://t.co/yDHwFp5mOT",2,2,0,44129,-,positif,-,https://x.com/spacerangersRRR/status/2066536029193216062
2065644451645849622,2026-06-13 03:56:29,xntjeje,"@ohmy_beautybank Klo review aku sbagai yg pernah pake keduanya, bkn msalah pmula kadang tp k cocok atau ga. Kulit aku oily acne prone. Wardah : tekstur ringan, coverage bagus, ga bs blind shade, rentan oksidasi, d aku malah nmbah jrawatan. Pixy : coverage oke, jarang gagal makeup klo pk pixy, -",2,0,1,288,Wardah,positif,-,https://x.com/xntjeje/status/2065644451645849622
2064644270766907521,2026-06-10 09:42:08,bearzolac_,PRODUK SKINCARE YG LAGI AKU PAKE!!! Facewash : Kahf Micellar Water : Wardah Toner : Finally Found You Serum brightening : Farmstay dan Minimalist Serum Retinal : Wardah Serum Eksfoliasi : Avess Moisturizer : Labore dan Embryolisse Sunscreen : Labore dan Kahf Tretinoin : Vitacid Kalau kalian ada pertanyaan seputar skincare atau minta review produknya komen aja.. 🐻✨ Kalau kalian pake skincare apa aja???,27,9,3,1626,Wardah,netral,-,https://x.com/bearzolac_/status/2064644270766907521
2063762342824083784,2026-06-07 23:17:40,nanajiyan,🥹 aku cuma mau cari sunscreen buat kulit berminyak... tapi kenapa ujung-ujungnya malah nonton review sunscreen 1 jam? 😭 — a thread sunscreen yang direkomendasiin buat kulit berminyak — 1. Skintific All Day Light Sunscreen Mist https://t.co/j1ReNFxpMz,147,129,19,1071,Skintific,positif,https://s.shopee.co.id/2qS1m0xgva,https://x.com/nanajiyan/status/2063762342824083784
2063580949602841015,2026-06-07 11:16:52,ohmy_beautybank,[bb] steel/iron mascara mending bnb atau wardah yaaaa? boleh review dan rekomendasinya dong guys!!!,2,0,3,1766,Wardah,positif,-,https://x.com/ohmy_beautybank/status/2063580949602841015
2063154620776788426,2026-06-06 07:02:47,imzie111,"Brand Lokalan Khusus FlatShoes Murah OOTD.. Cuma 50k an aja gess,mumpung promo buruan serbu cocok buat nongkrong,kerja,kuliah... Toko khusus Barang Murmer tapi kualitas mantap ✨ A thread 🧵 https://t.co/xAnWdKlcsJ",0,0,5,776,-,positif,-,https://x.com/imzie111/status/2063154620776788426
2061637137011966281,2026-06-02 02:32:51,nanajiyan,3. 💗 Skintific Cushion aku yakin hampir semua beauty girl pernah lihat cushion ini 😭 review-nya ada di mana-mana. yang paling sering aku lihat: ✨ coverage bagus ✨ gampang diblend ✨ bikin complexion keliatan lebih halus https://t.co/OlvgwVv1E0,146,132,10,512,Skintific,positif,https://s.shopee.co.id/3B4ioxHm5Z,https://x.com/nanajiyan/status/2061637137011966281
2061307169891549262,2026-06-01 04:41:41,befiercetaynew,P airjung review skintific foundation of polcasan so cute 🥰 Newwiee cousin is supportive https://t.co/P5Op34yvl4,75,36,0,1821,Skintific,netral,-,https://x.com/befiercetaynew/status/2061307169891549262
