tweet_id,tanggal,username,teks,likes,retweets,replies,views,brand_disebut,sentimen,link_rekomendasi,url
2058745079032922353,2026-05-25 03:00:51,ohmy_beautybank,[Bb] Ada yg pake tinted sa wardah ga? Review jujurnya dong gurl. Buat kulit kering dipake di ruangan ac seharian aman ga ya,1,0,0,1808,Wardah,netral,-,https://x.com/ohmy_beautybank/status/2058745079032922353
2058080608417681667,2026-05-23 07:00:28,intanyzz,"KALO SEKARANG PAKAI SKINCARE APA AJA? Pakai basic Labore mengubah hidupku bgt😭🫰🏻 ngatasin jerawat, kemerahan, bruntusan OKE BGT The originote : https://t.co/GzeFxuiJiM Fw cosrx : https://t.co/DR953jq0KP Labore : https://t.co/euSVJWWxSP SS Azarine : https://t.co/uVbW0dSAVQ https://t.co/BhP3FMd3UP",0,0,1,3755,"Azarine, Cosrx",positif,"https://s.shopee.co.id/gN6tNpO7n, https://s.shopee.co.id/9UyVPf8MqW, https://s.shopee.co.id/6VKtqDWTId, https://s.shopee.co.id/1BJNUS5z88",https://x.com/intanyzz/status/2058080608417681667
2057376989338898744,2026-05-21 08:24:33,f1triana,"@ohmy_beautybank ini aku sempet ss. ga bisa kasih review. pernah pake glasting wardah tapi neda warna, aku aman aja si pake glasting https://t.co/2GrrhDT6bp",3,0,1,498,Wardah,netral,-,https://x.com/f1triana/status/2057376989338898744
2051244011575459978,2026-05-04 10:14:17,strbelimatcha,@Skincare_IDN bnb aku pake ini yang roll to lenght (menurutku iya bikin kesan makin panjang) https://t.co/1eECHe6Os9 klo bnb yang bikin bervolume aku pake yg pink: https://t.co/MV2WnYS6kM tp td baca bbrp review ada yg blg ini wardah jg waterproof: https://t.co/PxSlirMgqv https://t.co/wg8DPk5nQ2,4,3,1,191,Wardah,netral,"https://s.shopee.co.id/7VCyESsMDv, https://s.shopee.co.id/LjnhcOgxN, https://s.shopee.co.id/3LNPH3kMcR",https://x.com/strbelimatcha/status/2051244011575459978
2050428813369339994,2026-05-02 04:14:58,brigitteaditria,GONG BANGET PAKE SERUM INI !! !! Baru sebulan pake ga nyangka se ngefek ini. Banyak banget yang notice kok cerahan sih pake apa??!!!✨✨ Ga bakal capek aku rekomendasiin buat kalian yg ada problem dark spot dan noda hitam buat cobain 👌🏻👌🏻 https://t.co/dZmHOKyxn7,0,0,1,2911,-,positif,-,https://x.com/brigitteaditria/status/2050428813369339994
2050263657502986449,2026-05-01 17:18:42,anyanjir,"@tanyakanrl Glasting. Glazed. Pokoknya yg glossy glossy ini. Klo ga biasa EMG berat. Tapi klo glossy nya ilang stainnya ada bgt. Jadi ky lip matte. Ini sgt awet. Tidak perlu touch up berulang.... AKU REVIEW BETULAN LHO INI ..... Klo ada budget pke make over. Klo yg agak murah, Wardah.",2,0,0,451,Wardah,positif,-,https://x.com/anyanjir/status/2050263657502986449
2050073297652469920,2026-05-01 04:42:17,womanfeeds_id,"{MU} review cushion ini ding guys bagusan yg ijo apa ungu? + sebut tipe kulit kalian. Aku pake wardah shade c21, dear me c01. Kalo ini ambil shade apa ya? https://t.co/N5OXuwetKk",15,1,8,5981,Wardah,positif,-,https://x.com/womanfeeds_id/status/2050073297652469920
2049840690641920480,2026-04-30 13:17:59,nadyakhanza,review pemakaian aku sendiri ya aja &amp; finishnya. skin type: normal to dry.. 🔗https://t.co/pr0pQCuFRv charlotte - somethinc 🔗https://t.co/b2yQqI51nB happy - joylab 🔗https://t.co/fEj2U9OlYJ ffy 🔗https://t.co/dQmJivdeAM fair 1 - wardah ku review singkat yaa⤵️,7,1,1,2224,"Somethinc, Wardah",netral,"http://s.shopee.co.id/40YA1X48Iw, http://s.shopee.co.id/8UtI1Eeoyn, http://s.shopee.co.id/3VdsF02HuZ, http://s.shopee.co.id/7KhmdicERG",https://x.com/nadyakhanza/status/2049840690641920480
2048372926014246946,2026-04-26 12:05:37,bittercaffeines,Wardah punya parfum 50ribuan yg wanginya enak2 &amp; cocok buat daily! Pantes pas Xaviera di Korea sampe ada yg nanyain parfumnya… Sini aku review varian yg aku punya 👇 https://t.co/OsWdU8JdLb,154,104,24,105347,Wardah,positif,-,https://x.com/bittercaffeines/status/2048372926014246946
2047614434626187448,2026-04-24 09:51:38,vhaniiaa_,"baru liat review di tiktok, jadi makin penasaran sama Wardah Staylock katanya lip cream intense, smoother intense matte tapi tetep ringan &amp; moist-grip di bibir, warnanya juga cakep-cakep banget https://t.co/B9nyFlYwEG",2,2,2,642,Wardah,positif,-,https://x.com/vhaniiaa_/status/2047614434626187448
2047285638395736095,2026-04-23 12:05:07,tanyarlfes,"ada pernah nyobain lip vinyl omg, dazzle me, wardah, sama pixy ga?? tolong kasih review jujur nya plsss.. thank youu 💚",33,1,50,9646,Wardah,netral,-,https://x.com/tanyarlfes/status/2047285638395736095
2047236281227489632,2026-04-23 08:48:59,catsedih,@beautiaf nyimak review wardah,0,0,0,188,Wardah,netral,-,https://x.com/catsedih/status/2047236281227489632
2045149401036005639,2026-04-17 14:36:28,eskacanghijaauu,"Manifesting kulit sehat, cerah terawat dg basic skincare by Natasha. Sekarang udah engga perlu lg antre di kliniknya. Semua produk skincarenya sudah bisa dibeli di toko oren ✨ https://t.co/byaelEotZH",0,1,1,604,-,positif,-,https://x.com/eskacanghijaauu/status/2045149401036005639
2045085447345631737,2026-04-17 10:22:21,Mawrcellaa,🐻‍❄️ Day 4 - upload video di X Wardah - Colorfit Cream Blush (04 Ethereal Rose) Kayanya udah pada bosen aku review blush on ini wkwkwk. Tapi bener deh cakep banget warnanya! Formulanya juga oke dipakai after complexion ga bakal patchy Checkout di sini! 🛒: https://t.co/PcT0yDCvAM,3,0,0,964,Wardah,positif,https://s.shopee.co.id/9AKl77WRwu,https://x.com/Mawrcellaa/status/2045085447345631737
2044707905522532778,2026-04-16 09:22:08,nsvrn_,Dari Wardah aku jadi tau kalau ada istilah Sunscreen Language 🥹 biar gak asal fomo beli sunscreen lagi.. Untung sekarang ada si Sunscreen Collagen ini! 😍 cocok bgt buat repair skin barrier Soon aku review 🫶 #WardahSunscreen #SunscreenLanguageWardah #SunscreenKerangWardah https://t.co/b9c1SAV5dT,41,36,13,4473,Wardah,positif,-,https://x.com/nsvrn_/status/2044707905522532778
2044599310533394849,2026-04-16 02:10:37,Mawrcellaa,🐻‍❄️ Day 3 - upload video di X Moicare - Hair Treatment Shampoo Shampoo ini bantu kurangi rontok dan melebatkan rambut. Dipakainya seger banget di kulit kepala! Aman juga buat bumil &amp; busui. Checkout di sini ya! 🛒: https://t.co/rsd9Qshp93 https://t.co/2BSvRsT1da,2,0,0,1372,-,positif,https://s.shopee.co.id/9ztpy1Swbv,https://x.com/Mawrcellaa/status/2044599310533394849
2044353184857047159,2026-04-15 09:52:36,ohmy_beautybank,"[bb] guys mau nanya BANGET nih. aku kan kemaren baru beyi makeup, trs blm punya loose powderr (baru tau kl ini penting) aku liat"" banyak yg nyebut loose powder somethinc &amp; reka, boleh share honest review di skin type kalian? timaaciii🩷🩷🩷🩷",10,0,21,7188,Somethinc,netral,-,https://x.com/ohmy_beautybank/status/2044353184857047159
2044346027663049162,2026-04-15 09:24:09,womanfeeds_id,"{mu} Ada yg pernah cobain produk Wardah yg ini ga? Sender lagi nyari2 produk yg pas buat anti-aging dan mulai consider buat nyoba ini, tp masih ragu. 𝑨ffiliate minggir dulu ya, butuh review jujur 🫶 https://t.co/7klYb7zjLj",11,0,2,7408,Wardah,netral,-,https://x.com/womanfeeds_id/status/2044346027663049162
2044275958258250122,2026-04-15 04:45:43,skinsofun,Guys ada yang mau review Wardah Light+? hit my DM for folls 5k+,2,5,6,1554,Wardah,netral,-,https://x.com/skinsofun/status/2044275958258250122
2039662437163585880,2026-04-02 11:13:14,womanfeeds_id,"{mu} guys mau nanya, tipkul ku oily acne prone, mending skintint g2g atau skintific yah? Sekalian minta honest review nya dong hehe, makasiii",15,2,29,8288,Skintific,netral,-,https://x.com/womanfeeds_id/status/2039662437163585880
2039578217619857782,2026-04-02 05:38:35,itsriyuka,"2 brand lokal, 1 bibir: Wardah vs OMG lip product review 💄✨ Iseng cobain lip product dari Wardah &amp; OMG… ternyata hasilnya beda vibes banget di bibirku 👀💄 Mini review jujur versi aku https://t.co/MywGsnRYSq",138,72,8,1268,Wardah,positif,-,https://x.com/itsriyuka/status/2039578217619857782
2038989277082869891,2026-03-31 14:38:20,vrimrose,"hi guys, adakah yang pernah pakai sunscreen wardah yang ini? boleh bantu review nggak ya? thank you! https://t.co/hbhvJWFDSt",7,0,24,30709,Wardah,netral,-,https://x.com/vrimrose/status/2038989277082869891
2038234521607524798,2026-03-29 12:39:13,beautiaf,"my spray serum collection so far.🌷 wardah, muaq, trueve, studio tropik &amp; glad2glow. here the review &amp; rating. ꉂ(˵˃ ᗜ ˂˵) https://t.co/eAl8BuFIav",161,29,12,8259,Wardah,netral,-,https://x.com/beautiaf/status/2038234521607524798
2034914247990550588,2026-03-20 08:45:38,jmverse__,"ga nyangka tiba” udh sebanyak ini aja, aslinya udh bnyak yg dibuang si ini😭🥲 rekomen facial wash gentle/sabun cuci muka buat kalian yg punya kulit oily dan gampang jerawatan, plis ini facewash underrated banget pdhal hasilnya okee bangett🥺‼️dan harga nya under 100rb 😭😭🙏🏻 https://t.co/hmUXUW42c6",0,1,1,1681,-,positif,-,https://x.com/jmverse__/status/2034914247990550588
2034169018228027611,2026-03-18 07:24:21,ngalamfess,"Oyi rek, ada yg perna make skintific warna biru yg buat jerawat, review jujur nya dong klo ada",1,0,1,1057,Skintific,netral,-,https://x.com/ngalamfess/status/2034169018228027611
2032459521910816934,2026-03-13 14:11:25,MohamedAlali72,"وردة المنهالي، وروضة المرزوقي، الباحثتان في «تريندز»، تستعرضان أبرز المحاور والمناقشات التي تركزت حولها جلسات حوار «تريندز» الإستراتيجي، إلى جانب التوصيات والمخرجات التي قدمها الخبراء والمتخصصون حول الحرب في الشرق الأوسط وتداعياتها الإقليمية والدولية ومآلاتها المستقبلية. - Wardah Al Menhali and Rawdha AlMarzouqi, researchers at TRENDS, review the key themes and discussions highlighted during the TRENDS Strategic Dialogue sessions, as well as the main recommendations and outcomes presented by experts and specialists regarding the war in the Middle East, its regional and international implications, and its future trajectories.",2,0,0,77,Wardah,netral,-,https://x.com/MohamedAlali72/status/2032459521910816934
2029309809754030104,2026-03-04 21:35:36,fashion_ate,"CUSHION TERBAIK AWAL TAHUN JATUH KE WARDAH LITE SKIN CUSHION💫 yeyy akhirnya nemu cushion yg cocok di kulit keringku ini😭😭 gw pake seharian kuliah jg oke si minim bgt oksidasi dan yg terpenting ini udah ada refillnya jg, kecintaan bgt!! kalian ada yg pake jg ga? review dong🙌 https://t.co/17vKI5grxe",4,2,1,207,Wardah,positif,-,https://x.com/fashion_ate/status/2029309809754030104
2029185174626545907,2026-03-04 13:20:20,glossygita,"Best cushion: 💌 https://t.co/uifOQ1TzjD Kalo tahun 2024 juara cushion aku si Wardah Colorfit yang warna hijau, 2025 giliran si cream ini yg menang. Jujur suka bgt soalnya ini pas diaplikasikan ke muka berasa tipiiiiis bgt, tapi tetep definisi cushion yg coverage-nya darderdor sekaligus ringan dan kulit tetep bisa bernapas. Darderdor di sini maksudnya medium to high coverage yaah😆 pokoknya bisa fits both ur daily and bold makeup look🤍 Sobat dry skin kayak aku pasti bakal demen sama cushion ini karena finish-nya glowy. Di kulit jg gak berasa kering/ketarik, bahkan lumayan lembap (terhidrasi) soalnya ada kandungan skincare-nya. Aku pake shade 33W Olive Beige yah! Full review:",3,1,1,3021,Wardah,positif,"https://s.shopee.co.id/6VIrxHcTSN, https://s.shopee.co.id/6VIrxHcTSN",https://x.com/glossygita/status/2029185174626545907
2027652624351195549,2026-02-28 07:50:32,bluebee____,"@ohmy_beautybank Dari somethinc ka yang lipglazed varian unreal, review pribadi warnanya bagus bgt di bibir, kalo dipake di bibir ku si ga kering dan ga bikin pecah2. Patut dicoba😉 https://t.co/wZDV9RDHm2 https://t.co/nNDAiFyBMr",4,4,0,1197,Somethinc,positif,https://s.shopee.co.id/6pvbbkY5fd,https://x.com/bluebee____/status/2027652624351195549
2023359226651783258,2026-02-16 11:30:06,sbyfess,"-ning ada yg pernah ikutan beauty class Wardah ga? Bingung mau ikut tapi bimbang, pengen iya pengen gak, worth ga sih? Yg udah pernah, review dong. Kebetulan kali ini 200k, dpt voucher produknya 175",0,0,1,1169,Wardah,positif,-,https://x.com/sbyfess/status/2023359226651783258
2020809819351925049,2026-02-09 10:39:40,natanattda,"Review jujur penggunaan 3 cushion yakni skintific, tirtir, somethinc selama beberapa minggu. ST: combi oily Skin concern: hyperpigmentation (PIH), hormonal acne, oily t-zone Expectation: minimum oxidation, medium to full coverage, long lasting https://t.co/ofyDdtdTGo",97,7,1,8887,"Somethinc, Skintific",netral,-,https://x.com/natanattda/status/2020809819351925049
2020434601479463259,2026-02-08 09:48:41,womanfeeds_id,gess wardah glossicle tinted lip balm bagusss ga yaaaa? Review dungs yang pernah pakeee. Tengkyuuu {mu},5,1,6,4748,Wardah,positif,-,https://x.com/womanfeeds_id/status/2020434601479463259
2018675094608867504,2026-02-03 13:17:02,blissfulfancy,"banyak yg review sunscreen wardah, penasaran bgt",2,0,2,278,Wardah,netral,-,https://x.com/blissfulfancy/status/2018675094608867504
2018524198713557382,2026-02-03 03:17:25,lilaczvo,"This is your sign to trust the process🤍 Lagi konsisten pakai basic skincare akhir akhir ini. No ribet, no overstep — fokus jaga kulit biar tenang dulu, and honestly... it works. The Product my skin now✨ https://t.co/1xlqRAsIUS",311,121,40,14227,-,positif,-,https://x.com/lilaczvo/status/2018524198713557382
2016137921649410559,2026-01-27 13:15:13,sevheraaaanight,"Anak FH yg mau aku review CV ny bisa dm aja yaa. Cv aku kmrn dah tembus di Astra, garuda food, Mandiri, BNI, Skintific, n masi banyak lagii (free kok oll)",4,0,4,951,Skintific,positif,-,https://x.com/sevheraaaanight/status/2016137921649410559
2015805490434117772,2026-01-26 15:14:15,pistahsyo,"sini gue aja yg review😊😊😊 free kok😚😚😚 cv gue udh tembus astra, paragon, kpmg, pwc, garudafood, p&amp;g, MAP, dan google. kalo lo nanya gue kerja dimana, di yg paling pertama yah🫶 rep aku nanti ku dm duluan❤️",40889,2279,1478,1356141,-,positif,-,https://x.com/pistahsyo/status/2015805490434117772
2014743820429344800,2026-01-23 16:55:33,venusfogg,"@womanfeeds_id Honest review agak kureng tapi oily glownya bisa dibicaran kalau sesama paragon mending make over meskiiun agak tebel dikit , kalau wardah grindil tengah kurang suka juga 😔🙏🏻",49,0,0,10236,Wardah,positif,-,https://x.com/venusfogg/status/2014743820429344800
2009212264877031749,2026-01-08 10:35:07,Domenarn,"@ohmy_beautybank ini personal review dr aku buat deinfluence km ya kak: 1. wardah: oksidasi bgt terus terlalu creamyy, shadenya jg tricky 2. rad: oksidasi dikitt, dan comedogenic, kebetulan boikot jg 3. pixy: paling nyaman soalnya ringan tapi oksidasinya lumayan jg kaya wortel 🥲",1,0,7,4874,Wardah,positif,-,https://x.com/Domenarn/status/2009212264877031749
2008963073202360774,2026-01-07 18:04:56,selomiatii,"@womanfeeds_id review jujur, wardah ijo ini mantep bgt si, kulitku oily parah udh berbagai merk tetep kusam eh taunya pas iseng nyoba ini mantep bgt, minusnya ga toneup si https://t.co/m5OD6R1Hp0",5,0,1,763,Wardah,negatif,-,https://x.com/selomiatii/status/2008963073202360774
2008955306710270382,2026-01-07 17:34:04,stupefyyprotego,"@ohmy_beautybank review jujur dr aku yg tipkulnya combi kak 1. you di aku oksidasi parah, tp finishnya oke bgttttt 2. dazzleme longsorrrrr bgttt nangiddddd😭😭☝🏻☝🏻. kek dipake 3 jam uda longsorr.. 3. somethinc BAGUSS POLL di aku, flawless bgt tp mukaku sensitif pake itu, jadi bruntusan di dahiii",18,0,1,8975,Somethinc,positif,-,https://x.com/stupefyyprotego/status/2008955306710270382
2008116536964464992,2026-01-05 10:01:06,pweetynxi,"💞 Sebelum ku review, ini imo tergantung skintype paling bagus yang mana: 1. Azloe : oily https://t.co/EUR5QisphW 2. Somethinc : dry https://t.co/uEqYTZCDvk 3. Facetology : oily https://t.co/XStGUWt9Wl 4. Glamazing : all skin type https://t.co/cG3m64eapd https://t.co/DrV8ODqSP2",3,1,1,1038,Somethinc,positif,"https://s.shopee.co.id/9KbYbGQ4xO, https://s.shopee.co.id/6VHNE5MNR6, http://s.shopee.co.id/6Kxx15EOac, http://s.shopee.co.id/AUnVz6KVtC, https://x.com/i/status/2008111937574584755",https://x.com/pweetynxi/status/2008116536964464992
2008111937574584755,2026-01-05 09:42:49,pweetynxi,Currently I often use skintint or tinted sunscreen for daily🌻 https://t.co/4mK3mFY5KR,161,130,14,8586,-,netral,-,https://x.com/pweetynxi/status/2008111937574584755
2008092487991390661,2026-01-05 08:25:32,yourmalv,Buat skrg aku lg seringnya pake conplexion dr wardah colorfit yg 21W. Anw best cushion yg ak pake buat 2025 adalah si wardah ini &amp; cushion judydoll full review bs dilihat di sini ya https://t.co/qZxU9qHjCU https://t.co/anMN7J6Pia,4,0,1,3507,Wardah,netral,"https://x.com/yourmalv/status/1965621573370671285?s=46, https://x.com/yourmalv/status/2004068889026765157?s=46",https://x.com/yourmalv/status/2008092487991390661
2007023015654224180,2026-01-02 09:35:50,beautiaf,"rate and review my MUTED LIPPIES collection from local brand. ( ˶ˆ꒳ˆ˵ ) make over, wardah and kula.🌷💗 https://t.co/lTkMJYb0FI",451,61,23,45821,Wardah,netral,-,https://x.com/beautiaf/status/2007023015654224180
2006426095915085866,2025-12-31 18:03:53,BaseBDG,Euy review dong buat bedak padat tu bagus instaperfect/wardah yaa,2,0,5,1709,Wardah,positif,-,https://x.com/BaseBDG/status/2006426095915085866
2005491556665757778,2025-12-29 04:10:21,Mawrcellaa,"Review jujur koleksi Wardah EDT tapi pakai bahasa bayi, because explaining perfume shouldn’t be complicated 👶🏻🍼 https://t.co/Lz1gNTLByp",1220,130,36,150746,Wardah,netral,-,https://x.com/Mawrcellaa/status/2005491556665757778
2004402617326489841,2025-12-26 04:03:18,womanfeeds_id,tolong review jujurnya dong {mu} serum exfoliasi skintific ungu ini beneran works gak di kaliann? https://t.co/OP0gO8N7Kd,1,1,1,6140,Skintific,netral,-,https://x.com/womanfeeds_id/status/2004402617326489841
2004068889026765157,2025-12-25 05:57:11,yourmalv,So in love with my complexion 🤍 Makeup tahan banting dan finishnya super smooth! https://t.co/MkjQSlFZg8,621,85,32,33527,-,positif,-,https://x.com/yourmalv/status/2004068889026765157
2003844316813205974,2025-12-24 15:04:49,ohmy_beautybank,[bb] review jujur dong guys... oksidasinya gimana? tahan ga untuk kulit oily? aku pake pixy powder foundation shade 303w klo cushion wardah ini shade apa ya? https://t.co/47cNIElilz,32,1,9,11638,Wardah,positif,-,https://x.com/ohmy_beautybank/status/2003844316813205974
2001987245423857678,2025-12-19 12:05:29,womanfeeds_id,"BETTER MANA ✨Tinted Sunscreen AMATERASUN / Somethinc ✨ {mu} sharing honest review dungs , no aff 🫶🏻",2,0,2,4498,Somethinc,netral,-,https://x.com/womanfeeds_id/status/2001987245423857678
2000916023353204839,2025-12-16 13:08:49,beautiaf,"honorable mention, wardah colorfit glow cushion &amp; wardah colorfit 5D cloud cushion. karena sebelum ketemu yg 3 di atas aku sering bgt pake mereka dan sekarang udah otw yg ke-2 apalagi yg glow aku sampe punya stock🤭 baca full review semua cushionnya di sini yah⤵️ https://t.co/33VlUg6Kkv",3,0,1,2525,Wardah,netral,-,https://x.com/beautiaf/status/2000916023353204839
2000802460500430936,2025-12-16 05:37:34,sebbieain,Lah Jeffree Star review lip serum Skintific. Gigih aku tengok sampai habis nak tahu it is Jeffree Star approved atau tak hahahah. Kalau tak approve aku amuk ya sebab lip serum Skintific is one of my fav!!! 😆￼ https://t.co/UoSjUbhs0X,1,0,1,417,Skintific,positif,-,https://x.com/sebbieain/status/2000802460500430936
2000069344504484330,2025-12-14 05:04:25,ohmy_beautybank,[bb] siapa yang udah cobain light+ by wardah? PLEASE REVIEW JUJURRRRR,2,0,0,2021,Wardah,netral,-,https://x.com/ohmy_beautybank/status/2000069344504484330
1999725679215100097,2025-12-13 06:18:49,ohmy_beautybank,boleh review pemakaian lip somethinc? sama foto juga kalo boleh [bb],0,0,0,1890,Somethinc,netral,-,https://x.com/ohmy_beautybank/status/1999725679215100097
1999053887081525312,2025-12-11 09:49:21,beautiaf,selama tahun 2025 ini aku BUANYAK POLLLL cobain cushion dan terbanyak dari paragon: wardah &amp; emina best seller🤣🤣 make over blm kesampean😫🙏🏻 so here’s the review!!,35,1,1,24629,"Wardah, Emina",netral,-,https://x.com/beautiaf/status/1999053887081525312
1999051784955035995,2025-12-11 09:41:00,beautiaf,rate &amp; review: all of my PARAGON cushion. ᦚ( ◍•ᴗ•◍) https://t.co/gJJ6jZAsfE,6891,371,42,370915,-,netral,-,https://x.com/beautiaf/status/1999051784955035995
1995823260999598387,2025-12-02 11:52:00,femalesrage,"sumpil cushion lite wardah semantul senyaman itu, cushion skintipik gue sampe gue hempas! dan ini bukan karena BAnya leya ini bener2 honest review PARAGON JAYA JAYA JAYA",3,0,3,1072,Wardah,netral,-,https://x.com/femalesrage/status/1995823260999598387
1993660940588609700,2025-11-26 12:39:43,tonkatsuni,masa sengkek pun dah cantik ni kalau kaya nanti boleh buat review skintific kat tiktok,3,0,1,104,Skintific,positif,-,https://x.com/tonkatsuni/status/1993660940588609700
1992005641859166549,2025-11-21 23:02:09,womanfeeds_id,"{MU} gusy ini dempul bgt ga ya buat sehari2 review dong? Atau ada saran powder foundation lain yg lebih bagus? Aku biasanya pake cushion wardah,make over tuh 21c, dear me c01 kalo ini shade apa ya? https://t.co/4PQPswFF3d",182,2,22,24101,Wardah,positif,-,https://x.com/womanfeeds_id/status/1992005641859166549
1991851835842609255,2025-11-21 12:50:59,myrarhmnn,Battle &amp; review lip product 🇮🇩🇲🇾 Wardah tinted lipbalm Timephoria lipvelvet https://t.co/UKHZc7363o,198,29,1,27843,Wardah,netral,-,https://x.com/myrarhmnn/status/1991851835842609255
1991493956253937741,2025-11-20 13:08:53,suzyjij,"wts want to sell new preloved Skintific Velvet Matte Cushion - 02 Ivory 💸70k, bisa🍊ada admin atau split payment 2x tap aja buat review Exp 09/2027 puff pengganti, ada grafir nama di case #zonauang #zonabu #zonajajan https://t.co/3yZefbrpSU",2,0,5,650,Skintific,positif,-,https://x.com/suzyjij/status/1991493956253937741
1991078568722399627,2025-11-19 09:38:17,beautiaf,"my spray serum local brand collection.🌷 wardah, muaq &amp; studio tropik. here the review &amp; rating. ꉂ(˵˃ ᗜ ˂˵) https://t.co/1izCSW1cGR",899,263,46,58503,Wardah,netral,-,https://x.com/beautiaf/status/1991078568722399627
1990119907477127555,2025-11-16 18:08:55,nrsrwhz,"Skintific Skintint 👑 my favourite! Thick, medium &amp; buildable coverage, yet easy to blend! Kalau you malas make up beria, this one is for you 😍🫶🏻 🛒: https://t.co/gVq4jjY9E7 Also, my initial review on this! https://t.co/kIg13K336O https://t.co/MdURLxrN7X",4,0,1,1934,Skintific,netral,"https://s.shopee.com.my/1qUGS2uTCb, https://x.com/nrsrwhz/status/1967434485475254739?t=4gRPqxk_9Psj3gOyino3CQ&s=19",https://x.com/nrsrwhz/status/1990119907477127555
1988125185825009989,2025-11-11 06:02:36,pemburupromo28,"Anjlok lagi harga nya Indomilk durian 9.500 udah dapat 2 pcs cusss buat bikin es durian 🤤 https://t.co/atGZUCRz4O Skintific n Vitamin C brightening serum cusss 95rb aja, banyak review yg bilang ini bagus pol https://t.co/7oFCftDsvb https://t.co/fHiGuDK620",3,2,0,563,Skintific,positif,"https://s.blibli.com/GNtk/ljuji6o8, https://s.blibli.com/GNtk/74f1os03",https://x.com/pemburupromo28/status/1988125185825009989
1988099654626820328,2025-11-11 04:21:09,skinlovelies,"Review singkat aja ya guys, kalau vid applynya aku bantu kasih liat dari konten lama aku aja karna emang aku sering bikin konten makeup pakai somethinc produk. NO AFFILIATE.",0,0,1,270,Somethinc,netral,-,https://x.com/skinlovelies/status/1988099654626820328
1988099650096894351,2025-11-11 04:21:08,skinlovelies,Review singkat SOMETHINC MAKEUP yang palinggg aku suka dan bakal aku repurchase terusssss. https://t.co/cP0PRuql8b,150,142,42,3650,Somethinc,positif,-,https://x.com/skinlovelies/status/1988099650096894351
1988059771388481737,2025-11-11 01:42:40,4everluvhan,"@txtfrombrand review jujur dong, beneran gak somethinc bagus?? kamu pakai produk yang apa??🫶🏼",37,1,155,71613,Somethinc,positif,-,https://x.com/4everluvhan/status/1988059771388481737
1987865376563097781,2025-11-10 12:50:13,ohmy_beautybank,[bb] ad yang make cushion wardah ini ga? boleh review nya? Kira-kira oksidasi parah ga ya? thanks. https://t.co/k6HLoafpBE,64,1,42,14714,Wardah,netral,-,https://x.com/ohmy_beautybank/status/1987865376563097781
1987828182989623611,2025-11-10 10:22:25,heybogosipeo,Rate &amp; review Somethinc-things —local proud💜 worth the hype? https://t.co/TFt8drLcz6,447,81,28,32755,Somethinc,positif,-,https://x.com/heybogosipeo/status/1987828182989623611
1987716951788183947,2025-11-10 03:00:25,kforkinsley,Mini review: all Somethinc makeup I’ve tried https://t.co/5gzLU5P3HL,3092,220,32,152468,Somethinc,netral,-,https://x.com/kforkinsley/status/1987716951788183947
1987217754144084065,2025-11-08 17:56:47,clumshyness,"@womanfeeds_id Aku tipe orang yg harus cek review dulu sebelum mutusin beli, jadi so far produk yg menurut aku oke bgt dari somethinc: - ceraplump (shade coquette) - cushion hooman (shade coco) - mascara Aku pakai skin tintnya (cashew) dan contour (pow), tapi menurut aku so-so aja",7,0,0,3357,Somethinc,positif,-,https://x.com/clumshyness/status/1987217754144084065
1987178271486960123,2025-11-08 15:19:54,hmtly,"buat series somethinc yang one piece lainnya aku quick review disini, just in case penisirin 🫶 https://t.co/IJfrWsqA7I",5,2,1,439,Somethinc,netral,-,https://x.com/hmtly/status/1987178271486960123
1987143902781186416,2025-11-08 13:03:20,womanfeeds_id,{mu} Produk somethinc yang worth to try apa ya?,8733,567,1274,669605,Somethinc,positif,-,https://x.com/womanfeeds_id/status/1987143902781186416
